<?xml version="1.0" encoding="UTF-8"?>
<!--Sample XML file generated by XMLSpy v2008 rel. 2 sp2 (http://www.altova.com)-->
<RegisterUserRequest xmlns="urn:tyler:efm:services:schema:RegistrationRequest" xmlns:xsi="http://www.w3.org/2001/XMLSchema-instance" xsi:schemaLocation="urn:tyler:efm:services:schema:RegistrationRequest ..\..\..\Schema\Admin\RegistrationRequest.xsd">
	<RegistrationType>Individual</RegistrationType>
	<Email>john.doe@tylertech.com</Email>
	<FirstName>John</FirstName>
	<MiddleName/>
	<LastName>Doe</LastName>
	<Password>@BC123xyz</Password>
	<PasswordQuestion>What color is the sky?</PasswordQuestion>
	<PasswordAnswer>blue</PasswordAnswer>
	<StreetAddressLine1>6500 International Pkwy</StreetAddressLine1>
	<StreetAddressLine2>Suite 2000</StreetAddressLine2>
	<City>Plano</City>
	<StateCode>TX</StateCode>
	<ZipCode>75093</ZipCode>
	<CountryCode>US</CountryCode>
	<FirmName></FirmName>
	<PhoneNumber>9727133770</PhoneNumber>
</RegisterUserRequest>
